article,sentence,keyword,cause/effect,content
118,87,使得,cause,市场供给进一步加大，解决住房问题途径更加多样化，,24,1,23
118,87,使得,effect,房贷需求增量呈递减趋势，租房贷款将呈递增趋势。,23,1,22
119,10,由于,cause,汽车领域的增值税、关税频繁出现调整,17,1,17
119,10,由于,effect,位于价格金字塔顶端的豪华汽车品牌也随之不断调整在华售价。,28,1,27
119,18,由于,cause,整体市场下滑，作为唯一保持稳定增幅的领域,20,1,6
119,18,由于,effect,豪华车品牌的价格竞争在过去一年中也在持续升温。,23,0,0
119,21,引发,cause,此前，增值税税率降低1%，,13,4,12
119,21,引发,effect,多家车企下调车价，其中有豪华车品牌车价下调超过3万元，照此推算，此次大幅调整增值税税率，车价有望最高降幅接近10万元。,59,1,8
119,24,使得,cause,2018年汽车行业疲软，汽车企业和经销商普遍资金压力增加，这,30,1,28
119,24,使得,effect,作为制造业支柱的汽车行业在新一轮刺激内需中的任务艰巨。,27,1,26
119,26,带来,cause,业内分析也指出，在价格敏感度不断增高的消费心理下，2019年启动的增值税高达三个百分点的减增，或将给汽车业,53,9,46
119,26,带来,effect,更明显的变化。,7,0,0
119,29,促进,cause,此次减税之后，汽车价格有望进一步降低，,19,1,18
119,29,促进,effect,汽车消费。,5,0,0
121,2,@,cause,以下为上交所处罚,8,0,0
121,2,@,effect,全文：,3,0,0
121,18,由于,cause,,0,0,0
121,18,由于,effect,,0,0,0
121,21,因,cause,,0,0,0
121,21,因,effect,终止股份转让事项。,9,0,0
121,23,引发,cause,同时，因名人效应等因素叠加，龙薇传媒严重误导市场及投资者，,29,4,28
121,23,引发,effect,市场和媒体高度关注，严重扰乱了正常的市场秩序。,23,1,9
121,47,归因于,cause,,0,0,0
121,47,归因于,effect,金融机构融资审批失败，未披露在应支付第二笔股权转让款时银必信未准备足够资金的事实，相关信息披露存在重大遗漏。,54,0,0
121,48,@,cause,五、龙薇传媒关于积极,10,0,0
121,48,@,effect,本次控股权转让交易顺利完成的信息披露存在虚假记载、误导性陈述,30,0,0
121,49,@,cause,,0,0,0
121,49,@,effect,本次交易顺利完成，同时继续寻求其他金融机构股票质押融资。,28,0,0
121,54,@,cause,龙薇传媒关于“立即与其他银行进行过多次沟通”的信息披露存在虚假记载，“将积极与万家集团进行沟通以,48,0,0
121,54,@,effect,本次交易顺利完成”等表述存在误导性陈述。,20,0,0
121,55,因,cause,,0,0,0
121,55,因,effect,,0,0,0
121,75,@,cause,,0,0,0
121,75,@,effect,,0,0,0
121,77,@,cause,,0,0,0
121,77,@,effect,的执行。,4,0,0
121,79,@,cause,董事、监事、高级管理人员应当履行忠实勤勉义务，,23,0,0
121,79,@,effect,公司规范运作，并保证公司及时、公平、真实、准确和完整地披露所有重大信息。,36,0,0
122,7,@,cause,,0,0,0
122,7,@,effect,,26,0,0
124,9,由于,cause,基础设施欠账多、产业底子薄,13,1,13
124,9,由于,effect,桶井2014年贫困发生率超过46%。,18,1,17
125,16,由于,cause,联通和电信渴望在5G时代翻身，,15,1,14
125,16,由于,effect,他们应该会延续在4G时的收费策略，即量大实惠薄利多销吸引用户。,31,1,30
125,18,所以,cause,前不久，中国电信副总经理高同庆曾公开表示，5G网络下收费可以分为多种，比如面向VR、8K高清直播、视频监控等用的是大流量计费，面向体育、演唱会等现场用直播动态计费，一般用户使用的流量是基础计费等,97,22,97
125,18,所以,effect,至于智能手机使用5G网络的收费范畴，则继续以足量的性价比模式，而真正利润来源是针对企业用户不同需求来收取不同的费用。,58,1,57
